Sheet: Planilha1
B1: of:=[.H1] -> 0.1 | G1: Decimal (entrada): | H1: 0.1
B2: of:=IF([.B1]>0;0;1) -> 0 | G2: IEEE-754 (saída): | H2: of:=[.B2]&DEC2BIN([.B4]+127+[.F4];8)&[.F5]&[.F6]&[.F7]&[.F8]&[.F9]&[.F10]&[.F11]&[.F12]&[.F13]&[.F14]&[.F15]&[.F16]&[.F17]&[.F18]&[.F19]&[.F20]&[.F21]&[.F22]&[.F23]&[.F24]&[.F25]&[.F26]&[.F27] -> 00111101110011001100110011001101
B3: of:=ABS([.B1]) -> 0.1
B4: of:=INT(LN([.B3])/LN(2)) -> -4 | E4: 0 | F4: of:=IF(COUNTIF([.E4:.$E$28];0) = 1;1;IF(COUNTIF([.E4:.$E$28];0)=0;0;[.E4])) -> 0
A5: 1 | B5: of:=[.B3]-2^[.B4] -> 0.0375 | C5: of:=INT(LN([.B5])/LN(2)) -> -5 | D5: of:=[.$B$4]-[.C5] -> 1 | E5: of:=COUNTIF([.$D$5:.$D$28];[.A5]) -> 1 | F5: of:=IF(COUNTIF([.E5:.$E$28];0) = 1;1;IF(COUNTIF([.E5:.$E$28];0)=0;0;[.E5])) -> 1
A6: 2 | B6: of:=[.B5]-2^[.C5] -> 0.00625000000000001 | C6: of:=INT(LN([.B6])/LN(2)) -> -8 | D6: of:=[.$B$4]-[.C6] -> 4 | E6: of:=COUNTIF([.$D$5:.$D$28];[.A6]) -> 0 | F6: of:=IF(COUNTIF([.E6:.$E$28];0) = 1;1;IF(COUNTIF([.E6:.$E$28];0)=0;0;[.E6])) -> 0
A7: 3 | B7: of:=[.B6]-2^[.C6] -> 0.00234375000000001 | C7: of:=INT(LN([.B7])/LN(2)) -> -9 | D7: of:=[.$B$4]-[.C7] -> 5 | E7: of:=COUNTIF([.$D$5:.$D$28];[.A7]) -> 0 | F7: of:=IF(COUNTIF([.E7:.$E$28];0) = 1;1;IF(COUNTIF([.E7:.$E$28];0)=0;0;[.E7])) -> 0
A8: 4 | B8: of:=[.B7]-2^[.C7] -> 0.000390625000000006 | C8: of:=INT(LN([.B8])/LN(2)) -> -12 | D8: of:=[.$B$4]-[.C8] -> 8 | E8: of:=COUNTIF([.$D$5:.$D$28];[.A8]) -> 1 | F8: of:=IF(COUNTIF([.E8:.$E$28];0) = 1;1;IF(COUNTIF([.E8:.$E$28];0)=0;0;[.E8])) -> 1
A9: 5 | B9: of:=[.B8]-2^[.C8] -> 0.000146484375000006 | C9: of:=INT(LN([.B9])/LN(2)) -> -13 | D9: of:=[.$B$4]-[.C9] -> 9 | E9: of:=COUNTIF([.$D$5:.$D$28];[.A9]) -> 1 | F9: of:=IF(COUNTIF([.E9:.$E$28];0) = 1;1;IF(COUNTIF([.E9:.$E$28];0)=0;0;[.E9])) -> 1
A10: 6 | B10: of:=[.B9]-2^[.C9] -> 0.0000244140625000056 | C10: of:=INT(LN([.B10])/LN(2)) -> -16 | D10: of:=[.$B$4]-[.C10] -> 12 | E10: of:=COUNTIF([.$D$5:.$D$28];[.A10]) -> 0 | F10: of:=IF(COUNTIF([.E10:.$E$28];0) = 1;1;IF(COUNTIF([.E10:.$E$28];0)=0;0;[.E10])) -> 0
A11: 7 | B11: of:=[.B10]-2^[.C10] -> 0.00000915527343750555 | C11: of:=INT(LN([.B11])/LN(2)) -> -17 | D11: of:=[.$B$4]-[.C11] -> 13 | E11: of:=COUNTIF([.$D$5:.$D$28];[.A11]) -> 0 | F11: of:=IF(COUNTIF([.E11:.$E$28];0) = 1;1;IF(COUNTIF([.E11:.$E$28];0)=0;0;[.E11])) -> 0
A12: 8 | B12: of:=[.B11]-2^[.C11] -> 0.00000152587890625555 | C12: of:=INT(LN([.B12])/LN(2)) -> -20 | D12: of:=[.$B$4]-[.C12] -> 16 | E12: of:=COUNTIF([.$D$5:.$D$28];[.A12]) -> 1 | F12: of:=IF(COUNTIF([.E12:.$E$28];0) = 1;1;IF(COUNTIF([.E12:.$E$28];0)=0;0;[.E12])) -> 1
A13: 9 | B13: of:=[.B12]-2^[.C12] -> 0.0000005722045898493 | C13: of:=INT(LN([.B13])/LN(2)) -> -21 | D13: of:=[.$B$4]-[.C13] -> 17 | E13: of:=COUNTIF([.$D$5:.$D$28];[.A13]) -> 1 | F13: of:=IF(COUNTIF([.E13:.$E$28];0) = 1;1;IF(COUNTIF([.E13:.$E$28];0)=0;0;[.E13])) -> 1
A14: 10 | B14: of:=[.B13]-2^[.C13] -> 0.00000009536743164618 | C14: of:=INT(LN([.B14])/LN(2)) -> -24 | D14: of:=[.$B$4]-[.C14] -> 20 | E14: of:=COUNTIF([.$D$5:.$D$28];[.A14]) -> 0 | F14: of:=IF(COUNTIF([.E14:.$E$28];0) = 1;1;IF(COUNTIF([.E14:.$E$28];0)=0;0;[.E14])) -> 0
A15: 11 | B15: of:=[.B14]-2^[.C14] -> 0.00000003576278687079 | C15: of:=INT(LN([.B15])/LN(2)) -> -25 | D15: of:=[.$B$4]-[.C15] -> 21 | E15: of:=COUNTIF([.$D$5:.$D$28];[.A15]) -> 0 | F15: of:=IF(COUNTIF([.E15:.$E$28];0) = 1;1;IF(COUNTIF([.E15:.$E$28];0)=0;0;[.E15])) -> 0
A16: 12 | B16: of:=[.B15]-2^[.C15] -> 0.00000000596046448309 | C16: of:=INT(LN([.B16])/LN(2)) -> -28 | D16: of:=[.$B$4]-[.C16] -> 24 | E16: of:=COUNTIF([.$D$5:.$D$28];[.A16]) -> 1 | F16: of:=IF(COUNTIF([.E16:.$E$28];0) = 1;1;IF(COUNTIF([.E16:.$E$28];0)=0;0;[.E16])) -> 1
A17: 13 | B17: of:=[.B16]-2^[.C16] -> 0.00000000223517418463 | C17: of:=INT(LN([.B17])/LN(2)) -> -29 | D17: of:=[.$B$4]-[.C17] -> 25 | E17: of:=COUNTIF([.$D$5:.$D$28];[.A17]) -> 1 | F17: of:=IF(COUNTIF([.E17:.$E$28];0) = 1;1;IF(COUNTIF([.E17:.$E$28];0)=0;0;[.E17])) -> 1
A18: 14 | B18: of:=[.B17]-2^[.C17] -> 0.0000000003725290354 | C18: of:=INT(LN([.B18])/LN(2)) -> -32 | D18: of:=[.$B$4]-[.C18] -> 28 | E18: of:=COUNTIF([.$D$5:.$D$28];[.A18]) -> 0 | F18: of:=IF(COUNTIF([.E18:.$E$28];0) = 1;1;IF(COUNTIF([.E18:.$E$28];0)=0;0;[.E18])) -> 0
A19: 15 | B19: of:=[.B18]-2^[.C18] -> 0.00000000013969839174 | C19: of:=INT(LN([.B19])/LN(2)) -> -33 | D19: of:=[.$B$4]-[.C19] -> 29 | E19: of:=COUNTIF([.$D$5:.$D$28];[.A19]) -> 0 | F19: of:=IF(COUNTIF([.E19:.$E$28];0) = 1;1;IF(COUNTIF([.E19:.$E$28];0)=0;0;[.E19])) -> 0
A20: 16 | B20: of:=[.B19]-2^[.C19] -> 0.00000000002328306992 | C20: of:=INT(LN([.B20])/LN(2)) -> -36 | D20: of:=[.$B$4]-[.C20] -> 32 | E20: of:=COUNTIF([.$D$5:.$D$28];[.A20]) -> 1 | F20: of:=IF(COUNTIF([.E20:.$E$28];0) = 1;1;IF(COUNTIF([.E20:.$E$28];0)=0;0;[.E20])) -> 1
A21: 17 | B21: of:=[.B20]-2^[.C20] -> 0.00000000000873115469 | C21: of:=INT(LN([.B21])/LN(2)) -> -37 | D21: of:=[.$B$4]-[.C21] -> 33 | E21: of:=COUNTIF([.$D$5:.$D$28];[.A21]) -> 1 | F21: of:=IF(COUNTIF([.E21:.$E$28];0) = 1;1;IF(COUNTIF([.E21:.$E$28];0)=0;0;[.E21])) -> 1
A22: 18 | B22: of:=[.B21]-2^[.C21] -> 0.00000000000145519707 | C22: of:=INT(LN([.B22])/LN(2)) -> -40 | D22: of:=[.$B$4]-[.C22] -> 36 | E22: of:=COUNTIF([.$D$5:.$D$28];[.A22]) -> 0 | F22: of:=IF(COUNTIF([.E22:.$E$28];0) = 1;1;IF(COUNTIF([.E22:.$E$28];0)=0;0;[.E22])) -> 0
A23: 19 | B23: of:=[.B22]-2^[.C22] -> 0.00000000000054570237 | C23: of:=INT(LN([.B23])/LN(2)) -> -41 | D23: of:=[.$B$4]-[.C23] -> 37 | E23: of:=COUNTIF([.$D$5:.$D$28];[.A23]) -> 0 | F23: of:=IF(COUNTIF([.E23:.$E$28];0) = 1;1;IF(COUNTIF([.E23:.$E$28];0)=0;0;[.E23])) -> 0
A24: 20 | B24: of:=[.B23]-2^[.C23] -> 0.00000000000009095502 | C24: of:=INT(LN([.B24])/LN(2)) -> -44 | D24: of:=[.$B$4]-[.C24] -> 40 | E24: of:=COUNTIF([.$D$5:.$D$28];[.A24]) -> 1 | F24: of:=IF(COUNTIF([.E24:.$E$28];0) = 1;1;IF(COUNTIF([.E24:.$E$28];0)=0;0;[.E24])) -> 1
A25: 21 | B25: of:=[.B24]-2^[.C24] -> 0.0000000000000341116 | C25: of:=INT(LN([.B25])/LN(2)) -> -45 | D25: of:=[.$B$4]-[.C25] -> 41 | E25: of:=COUNTIF([.$D$5:.$D$28];[.A25]) -> 1 | F25: of:=IF(COUNTIF([.E25:.$E$28];0) = 1;1;IF(COUNTIF([.E25:.$E$28];0)=0;0;[.E25])) -> 1
A26: 22 | B26: of:=[.B25]-2^[.C25] -> 5.68989300120393E-015 | C26: of:=INT(LN([.B26])/LN(2)) -> -48 | D26: of:=[.$B$4]-[.C26] -> 44 | E26: of:=COUNTIF([.$D$5:.$D$28];[.A26]) -> 0 | F26: of:=IF(COUNTIF([.E26:.$E$28];0) = 1;1;IF(COUNTIF([.E26:.$E$28];0)=0;0;[.E26])) -> 0
A27: 23 | B27: of:=[.B26]-2^[.C26] -> 2.13717932240343E-015 | C27: of:=INT(LN([.B27])/LN(2)) -> -49 | D27: of:=[.$B$4]-[.C27] -> 45 | E27: of:=COUNTIF([.$D$5:.$D$28];[.A27]) -> 0 | F27: of:=IF(COUNTIF([.E27:.$E$28];0) = 1;1;IF(COUNTIF([.E27:.$E$28];0)=0;0;[.E27])) -> 1
A28: 24 | B28: of:=[.B27]-2^[.C27] -> 3.60822483003176E-016 | C28: of:=INT(LN([.B28])/LN(2)) -> -52 | D28: of:=[.$B$4]-[.C28] -> 48 | E28: of:=COUNTIF([.$D$5:.$D$28];[.A28]) -> 1