Sheet: Planilha1
E1: Número: | F1: 1.02
E2: Expoente: | F2: of:=DEC2BIN([.B3]+127;8) -> 01111111
A3: of:=[.F1] -> 1.02 | B3: of:=INT(LOG([.A3];2)) -> 0 | E3: Mantissa
A4: of:=[.A3]-2^[.B3] -> 0.02 | B4: of:=INT(LOG([.A4];2)) -> -6 | C4: of:=[.$B$3]-[.B4] -> 6 | D4: 1 | E4: of:=COUNTIF([.$C$4:.$C$27];[.D4]) -> 0
A5: of:=[.A4]-2^[.B4] -> 0.00437500000000002 | B5: of:=INT(LOG([.A5];2)) -> -8 | C5: of:=[.$B$3]-[.B5] -> 8 | D5: 2 | E5: of:=COUNTIF([.$C$4:.$C$27];[.D5]) -> 0
A6: of:=[.A5]-2^[.B5] -> 0.000468750000000018 | B6: of:=INT(LOG([.A6];2)) -> -12 | C6: of:=[.$B$3]-[.B6] -> 12 | D6: 3 | E6: of:=COUNTIF([.$C$4:.$C$27];[.D6]) -> 0
A7: of:=[.A6]-2^[.B6] -> 0.000224609375000018 | B7: of:=INT(LOG([.A7];2)) -> -13 | C7: of:=[.$B$3]-[.B7] -> 13 | D7: 4 | E7: of:=COUNTIF([.$C$4:.$C$27];[.D7]) -> 0
A8: of:=[.A7]-2^[.B7] -> 0.000102539062500018 | B8: of:=INT(LOG([.A8];2)) -> -14 | C8: of:=[.$B$3]-[.B8] -> 14 | D8: 5 | E8: of:=COUNTIF([.$C$4:.$C$27];[.D8]) -> 0
A9: of:=[.A8]-2^[.B8] -> 0.0000415039062500178 | B9: of:=INT(LOG([.A9];2)) -> -15 | C9: of:=[.$B$3]-[.B9] -> 15 | D9: 6 | E9: of:=COUNTIF([.$C$4:.$C$27];[.D9]) -> 1
A10: of:=[.A9]-2^[.B9] -> 0.0000109863281250178 | B10: of:=INT(LOG([.A10];2)) -> -17 | C10: of:=[.$B$3]-[.B10] -> 17 | D10: 7 | E10: of:=COUNTIF([.$C$4:.$C$27];[.D10]) -> 0
A11: of:=[.A10]-2^[.B10] -> 0.00000335693359376776 | B11: of:=INT(LOG([.A11];2)) -> -19 | C11: of:=[.$B$3]-[.B11] -> 19 | D11: 8 | E11: of:=COUNTIF([.$C$4:.$C$27];[.D11]) -> 1
A12: of:=[.A11]-2^[.B11] -> 0.00000144958496095526 | B12: of:=INT(LOG([.A12];2)) -> -20 | C12: of:=[.$B$3]-[.B12] -> 20 | D12: 9 | E12: of:=COUNTIF([.$C$4:.$C$27];[.D12]) -> 0
A13: of:=[.A12]-2^[.B12] -> 0.00000049591064454901 | B13: of:=INT(LOG([.A13];2)) -> -21 | C13: of:=[.$B$3]-[.B13] -> 21 | D13: 10 | E13: of:=COUNTIF([.$C$4:.$C$27];[.D13]) -> 0
A14: of:=[.A13]-2^[.B13] -> 0.00000001907348634589 | B14: of:=INT(LOG([.A14];2)) -> -26 | C14: of:=[.$B$3]-[.B14] -> 26 | D14: 11 | E14: of:=COUNTIF([.$C$4:.$C$27];[.D14]) -> 0
A15: of:=[.A14]-2^[.B14] -> 0.00000000417232515204 | B15: of:=INT(LOG([.A15];2)) -> -28 | C15: of:=[.$B$3]-[.B15] -> 28 | D15: 12 | E15: of:=COUNTIF([.$C$4:.$C$27];[.D15]) -> 1
A16: of:=[.A15]-2^[.B15] -> 0.00000000044703485358 | B16: of:=INT(LOG([.A16];2)) -> -32 | C16: of:=[.$B$3]-[.B16] -> 32 | D16: 13 | E16: of:=COUNTIF([.$C$4:.$C$27];[.D16]) -> 1
A17: of:=[.A16]-2^[.B16] -> 0.00000000021420420993 | B17: of:=INT(LOG([.A17];2)) -> -33 | C17: of:=[.$B$3]-[.B17] -> 33 | D17: 14 | E17: of:=COUNTIF([.$C$4:.$C$27];[.D17]) -> 1
A18: of:=[.A17]-2^[.B17] -> 0.0000000000977888881 | B18: of:=INT(LOG([.A18];2)) -> -34 | C18: of:=[.$B$3]-[.B18] -> 34 | D18: 15 | E18: of:=COUNTIF([.$C$4:.$C$27];[.D18]) -> 1
A19: of:=[.A18]-2^[.B18] -> 0.00000000003958122718 | B19: of:=INT(LOG([.A19];2)) -> -35 | C19: of:=[.$B$3]-[.B19] -> 35 | D19: 16 | E19: of:=COUNTIF([.$C$4:.$C$27];[.D19]) -> 0
A20: of:=[.A19]-2^[.B19] -> 0.00000000001047739673 | B20: of:=INT(LOG([.A20];2)) -> -37 | C20: of:=[.$B$3]-[.B20] -> 37 | D20: 17 | E20: of:=COUNTIF([.$C$4:.$C$27];[.D20]) -> 1
A21: of:=[.A20]-2^[.B20] -> 0.00000000000320143911 | B21: of:=INT(LOG([.A21];2)) -> -39 | C21: of:=[.$B$3]-[.B21] -> 39 | D21: 18 | E21: of:=COUNTIF([.$C$4:.$C$27];[.D21]) -> 0
A22: of:=[.A21]-2^[.B21] -> 0.00000000000138244971 | B22: of:=INT(LOG([.A22];2)) -> -40 | C22: of:=[.$B$3]-[.B22] -> 40 | D22: 19 | E22: of:=COUNTIF([.$C$4:.$C$27];[.D22]) -> 1
A23: of:=[.A22]-2^[.B22] -> 0.00000000000047295501 | B23: of:=INT(LOG([.A23];2)) -> -41 | C23: of:=[.$B$3]-[.B23] -> 41 | D23: 20 | E23: of:=COUNTIF([.$C$4:.$C$27];[.D23]) -> 1
A24: of:=[.A23]-2^[.B23] -> 0.00000000000001820766 | B24: of:=INT(LOG([.A24];2)) -> -46 | C24: of:=[.$B$3]-[.B24] -> 46 | D24: 21 | E24: of:=COUNTIF([.$C$4:.$C$27];[.D24]) -> 1
A25: of:=[.A24]-2^[.B24] -> 3.99680288865056E-015 | B25: of:=INT(LOG([.A25];2)) -> -48 | C25: of:=[.$B$3]-[.B25] -> 48 | D25: 22 | E25: of:=COUNTIF([.$C$4:.$C$27];[.D25]) -> 0
A26: of:=[.A25]-2^[.B25] -> 4.44089209850063E-016 | B26: of:=INT(LOG([.A26];2)) -> -51 | C26: of:=[.$B$3]-[.B26] -> 51 | D26: 23 | E26: of:=COUNTIF([.$C$4:.$C$27];[.D26]) -> 0
A27: of:=[.A26]-2^[.B26] -> 0 | B27: of:=INT(LOG([.A27];2)) ->  | C27: of:=[.$B$3]-[.B27] ->  | D27: 24 | E27: of:=COUNTIF([.$C$4:.$C$27];[.D27]) -> 0 | F27: <== arredondador